{
  "generated_at": "2026-10-29T16:07:27+00:00",
  "coverage": [
    "austin_metro",
    "san_antonio_metro",
    "texas"
  ],
  "week_mode": "live",
  "areas": [
    {
      "id": "austin_metro",
      "type": "metro",
      "metrics": {
        "drought_stage": {
          "value": 2.0,
          "source": "U.S. Drought Monitor",
          "as_of": "2026-10-27",
          "vs_baseline": -0.3387,
          "wow": 0.0
        },
        "cooling_degree_days": {
          "value": 695.0,
          "source": "NOAA NCEI Global Summary of the Month",
          "as_of": "2026-09-01",
          "vs_baseline": 364.5,
          "mom": -60.0
        },
        "permit_activity_electrical": {
          "value": 1631.0,
          "source": "City of Austin Issued Construction Permits (Socrata)",
          "as_of": "2026-09-01",
          "vs_baseline": 309.9167,
          "mom": 121.0
        },
        "permit_activity_energy_storage": {
          "value": 188.0,
          "source": "City of Austin Issued Construction Permits (Socrata)",
          "as_of": "2026-09-01",
          "mom": 42.0,
          "withheld": [
            "vs_baseline: 3 complete periods since the source change recorded at 2026-07 (2026-07 to 2026-09) — under the 6-period minimum a half-over-half comparison needs to put three on each side"
          ]
        },
        "permit_activity_hvac": {
          "value": 1097.0,
          "source": "City of Austin Issued Construction Permits (Socrata)",
          "as_of": "2026-09-01",
          "vs_baseline": 205.6667,
          "mom": 62.0
        },
        "permit_activity_plumbing": {
          "value": 1296.0,
          "source": "City of Austin Issued Construction Permits (Socrata)",
          "as_of": "2026-09-01",
          "vs_baseline": 66.0833,
          "mom": -44.0
        },
        "permit_activity_roofing": {
          "value": 166.0,
          "source": "City of Austin Issued Construction Permits (Socrata)",
          "as_of": "2026-09-01",
          "vs_baseline": 10.3333,
          "mom": 22.0
        },
        "permit_activity_solar": {
          "value": 62.0,
          "source": "City of Austin Issued Construction Permits (Socrata)",
          "as_of": "2026-09-01",
          "vs_baseline": -18.9167,
          "mom": -18.0
        }
      }
    },
    {
      "id": "san_antonio_metro",
      "type": "metro",
      "metrics": {
        "drought_stage": {
          "value": 2.0,
          "source": "U.S. Drought Monitor",
          "as_of": "2026-10-27",
          "vs_baseline": -0.6129,
          "wow": 0.0
        },
        "cooling_degree_days": {
          "value": 689.0,
          "source": "NOAA NCEI Global Summary of the Month",
          "as_of": "2026-09-01",
          "vs_baseline": 352.1667,
          "mom": -11.0
        },
        "permit_activity_electrical": {
          "value": 819.0,
          "source": "City of San Antonio Permits Open Data",
          "as_of": "2026-09-01",
          "vs_baseline": 21.5,
          "mom": 31.0
        },
        "permit_activity_foundation": {
          "value": 229.0,
          "source": "City of San Antonio Permits Open Data",
          "as_of": "2026-09-01",
          "vs_baseline": -40.0,
          "mom": -50.0
        },
        "permit_activity_hvac": {
          "value": 1067.0,
          "source": "City of San Antonio Permits Open Data",
          "as_of": "2026-09-01",
          "vs_baseline": 158.5833,
          "mom": -63.0
        },
        "permit_activity_plumbing": {
          "value": 1728.0,
          "source": "City of San Antonio Permits Open Data",
          "as_of": "2026-09-01",
          "vs_baseline": -193.9167,
          "mom": -254.0
        },
        "permit_activity_roofing": {
          "value": 370.0,
          "source": "City of San Antonio Permits Open Data",
          "as_of": "2026-09-01",
          "vs_baseline": -44.1667,
          "mom": -24.0
        },
        "permit_activity_solar": {
          "value": 51.0,
          "source": "City of San Antonio Permits Open Data",
          "as_of": "2026-09-01",
          "vs_baseline": -5.9167,
          "mom": 18.0
        },
        "permit_activity_trees": {
          "value": 580.0,
          "source": "City of San Antonio Permits Open Data",
          "as_of": "2026-09-01",
          "vs_baseline": 337.5833,
          "mom": 129.0
        }
      }
    },
    {
      "id": "texas",
      "type": "state",
      "metrics": {
        "energy_price_cents_kwh": {
          "value": 15.91,
          "source": "EIA Electricity Data (Texas, residential)",
          "as_of": "2026-08-01",
          "vs_baseline": 0.3121,
          "mom": 0.03
        }
      }
    }
  ],
  "stories": [
    {
      "rank": 1,
      "area_id": "san_antonio_metro",
      "metric": "permit_activity_trees",
      "angle": "reveal",
      "surprise_score": 0.645,
      "why": "a large move against its own history; at a level well outside this area's own range",
      "figure": "580 tree permits in 2026-09, +29% month over month",
      "source": "City of San Antonio Permits Open Data",
      "as_of": "2026-09-01",
      "suppressed": false
    },
    {
      "rank": 2,
      "area_id": "austin_metro",
      "metric": "permit_activity_electrical",
      "angle": "reveal",
      "surprise_score": 0.453,
      "why": "at a level well outside this area's own range",
      "figure": "1,631 electrical permits in 2026-09, +8% month over month",
      "source": "City of Austin Issued Construction Permits (Socrata)",
      "as_of": "2026-09-01",
      "suppressed": false
    },
    {
      "rank": 3,
      "area_id": "san_antonio_metro",
      "metric": "permit_activity_foundation",
      "angle": "reveal",
      "surprise_score": 0.36,
      "why": "a modest move against its own history",
      "figure": "229 foundation permits in 2026-09, -18% month over month",
      "source": "City of San Antonio Permits Open Data",
      "as_of": "2026-09-01",
      "suppressed": false
    },
    {
      "rank": 4,
      "area_id": "san_antonio_metro",
      "metric": "permit_activity_plumbing",
      "angle": "reveal",
      "surprise_score": 0.336,
      "why": "a modest move against its own history",
      "figure": "1,728 plumbing permits in 2026-09, -13% month over month",
      "source": "City of San Antonio Permits Open Data",
      "as_of": "2026-09-01",
      "suppressed": false
    },
    {
      "rank": 5,
      "area_id": "austin_metro",
      "metric": "cooling_degree_days",
      "angle": "reveal",
      "surprise_score": 0.275,
      "why": "a modest move against its own history",
      "figure": "695 cooling degree-days in 2026-09, -8% vs the prior month",
      "source": "NOAA NCEI Global Summary of the Month",
      "as_of": "2026-09-01",
      "suppressed": false
    },
    {
      "rank": 6,
      "area_id": "san_antonio_metro",
      "metric": "cooling_degree_days",
      "angle": "reveal",
      "surprise_score": 0.259,
      "why": "a modest move against its own history",
      "figure": "689 cooling degree-days in 2026-09, -2% vs the prior month",
      "source": "NOAA NCEI Global Summary of the Month",
      "as_of": "2026-09-01",
      "suppressed": false
    },
    {
      "rank": 7,
      "area_id": "austin_metro",
      "metric": "permit_activity_hvac",
      "angle": "reveal",
      "surprise_score": 0.239,
      "why": "a modest move against its own history",
      "figure": "1,097 HVAC permits in 2026-09, +6% month over month",
      "source": "City of Austin Issued Construction Permits (Socrata)",
      "as_of": "2026-09-01",
      "suppressed": false
    },
    {
      "rank": 8,
      "area_id": "san_antonio_metro",
      "metric": "permit_activity_solar",
      "angle": "reveal",
      "surprise_score": 0.233,
      "why": "a modest move against its own history",
      "figure": "51 solar permits in 2026-09, +55% month over month",
      "source": "City of San Antonio Permits Open Data",
      "as_of": "2026-09-01",
      "suppressed": false
    },
    {
      "rank": 9,
      "area_id": "texas",
      "metric": "energy_price_cents_kwh",
      "angle": "reveal",
      "surprise_score": 0.202,
      "why": "a cost signal",
      "figure": "15.91¢ per kWh (2026-08), +0.2% month over month",
      "source": "EIA Electricity Data (Texas, residential)",
      "as_of": "2026-08-01",
      "suppressed": false
    },
    {
      "rank": 10,
      "area_id": "san_antonio_metro",
      "metric": "permit_activity_hvac",
      "angle": "reveal",
      "surprise_score": 0.201,
      "why": "a modest move against its own history",
      "figure": "1,067 HVAC permits in 2026-09, -6% month over month",
      "source": "City of San Antonio Permits Open Data",
      "as_of": "2026-09-01",
      "suppressed": false
    },
    {
      "rank": 11,
      "area_id": "austin_metro",
      "metric": "permit_activity_solar",
      "angle": "reveal",
      "surprise_score": 0.192,
      "why": "a modest move against its own history",
      "figure": "62 solar permits in 2026-09, -22% month over month",
      "source": "City of Austin Issued Construction Permits (Socrata)",
      "as_of": "2026-09-01",
      "suppressed": false
    },
    {
      "rank": 12,
      "area_id": "austin_metro",
      "metric": "permit_activity_roofing",
      "angle": "reveal",
      "surprise_score": 0.177,
      "why": "a modest move against its own history",
      "figure": "166 roofing permits in 2026-09, +15% month over month",
      "source": "City of Austin Issued Construction Permits (Socrata)",
      "as_of": "2026-09-01",
      "suppressed": false
    },
    {
      "rank": 13,
      "area_id": "austin_metro",
      "metric": "permit_activity_plumbing",
      "angle": "reveal",
      "surprise_score": 0.169,
      "why": "a modest move against its own history",
      "figure": "1,296 plumbing permits in 2026-09, -3% month over month",